{"contractVersion":"0.1.0","jobId":"job_sc1","stage":"script","projectId":"prj_u1","chapterId":"chp_u1","sourceVersionId":"srcv_u1","upstreamConfirmedVersionIds":["cv_uk1"],"status":"succeeded","items":[{"scopeKey":"scene:1/element:1","status":"succeeded","value":{"id":"se_u1","sceneId":"scene_u1","elementType":"action","text":"林岚接起电话","ordinal":1,"provenance":[{"type":"source_fragment","sourceVersionId":"srcv_u1","fragmentId":"frag_u1","transformation":"actionized"}]}}]}
